I wanna buy a house,Mortgage
I need loan for the house,Mortgage
I would like to get a mortgage,Mortgage
I need a house,Mortgage
I need a condo,Mortgage
I need an apartment,Mortgage
I need to buy a house,Mortgage
I need to buy a condo,Mortgage
I wish to buy a house,Mortgage
I need to rent,Mortgage
I wanna buy a house,Personal Loan
I need loan for the house,Personal Loan
I would like to get a mortgage,Personal Loan
I need a house,Personal Loan
I need a condo,Personal Loan
I need an apartment,Personal Loan
I need to buy a house,Personal Loan
I need to buy a condo,Personal Loan
I wish to buy a house,Personal Loan
I need to rent,Personal Loan
I wanna buy a checking account,Checking Account
I need to open bank account,Checking Account
I need to get bank account,Checking Account
I need a checking bank account,Checking Account
I need debit card,Checking Account
I want to open an account,Checking Account